{
  "$schema": "https://recursive-dev-loop.dev/schemas/feedback-log.v1.schema.json",
  "schema_version": "1.0.0",
  "feedback_id": "fb-runtime-generation-attestation-20260902",
  "change_id": "chg-runtime-generation-attestation-20260902",
  "created_at": "2026-09-02T23:23:34.000Z",
  "supersedes": null,
  "producer": {
    "actor": { "kind": "dsh-agent", "id": "agent-local" },
    "harness": { "name": "dsh", "version": "0.1.1-rc.2", "session_id": null },
    "repository": {
      "root": "repo://dsh-adaptive-loop",
      "revision": "8a58e50f98783c05cc63bf627153ae38ca27214c",
      "branch": "feat/runtime-generation-attestation",
      "dirty": true
    },
    "task_ref": null
  },
  "goal": "Implement deterministic runtime-generation attestation, fail-closed controller enrollment, focused evidence, and an approval-gated upstream tracking issue.",
  "acceptance_criteria": [
    {
      "id": "ac-runtime-contracts",
      "statement": "Closed manifest and evidence contracts provide deterministic I-JSON and RFC 8785 identity with separate assurance appraisal.",
      "result": "passed",
      "evidence": ["ev-focused-tests", "ev-contract"]
    },
    {
      "id": "ac-recorder-binding",
      "statement": "The recorder binds only at session creation and keeps checkpoints, malformed sources, replacements, and transition-spanning sessions ineligible.",
      "result": "passed",
      "evidence": ["ev-focused-tests", "ev-contract"]
    },
    {
      "id": "ac-controller-enrollment",
      "statement": "Controller enrollment verifies checked repository evidence and manifests, rejects duplicate sessions and invalid assurance, and preserves historical 1.0 snapshots without implicit attestation.",
      "result": "passed",
      "evidence": ["ev-focused-tests", "ev-review"]
    },
    {
      "id": "ac-repository-gate",
      "statement": "The focused proof and repository-wide verification gate pass.",
      "result": "passed",
      "evidence": ["ev-focused-tests", "ev-full-gate"]
    },
    {
      "id": "ac-upstream-issue",
      "statement": "The exact upstream tracking issue is published only after verification of a matching unexpired send_data_externally approval.",
      "result": "not_run",
      "evidence": ["ev-issue-request", "ev-approval-blocker"]
    }
  ],
  "outcome": {
    "status": "blocked",
    "summary": "Implementation and local verification completed, but the prepared GitHub tracking issue was not published because no exact external-transfer approval exists.",
    "exception": {
      "kind": "blocked",
      "reason": "GitHub issue publication requires a separate approved, unexpired send_data_externally decision bound to the exact prepared payload scope.",
      "owner": "workspace-user",
      "next_action": "Review the prepared issue request, provide a matching approval decision, verify it at publication time, and then publish the unchanged payload."
    }
  },
  "what_worked": [
    "The runtime identity and appraisal contracts remain separate and fail closed.",
    "Descriptor-backed repository reads removed the evidence check-and-reopen race and reject unsupported safe-open platforms.",
    "Controller policy and state 1.0 snapshots remain valid while new estimates require version 1.1 runtime policy.",
    "Focused and repository-wide verification passed."
  ],
  "what_failed": [
    "Pinned DSH does not produce authoritative runtime-generation evidence or await asynchronous disposal listeners.",
    "The external GitHub publication remained gated because no matching approval decision was supplied."
  ],
  "calls": [
    {
      "sequence": 1,
      "kind": "tool",
      "name": "vitest",
      "purpose": "Run focused runtime-generation, recorder, controller, and provenance regression tests.",
      "outcome": "succeeded",
      "duration_ms": null,
      "evidence": ["ev-focused-tests"]
    },
    {
      "sequence": 2,
      "kind": "tool",
      "name": "code-review",
      "purpose": "Audit schema compatibility, session lifecycle assumptions, and repository evidence loading.",
      "outcome": "succeeded",
      "duration_ms": null,
      "evidence": ["ev-review"]
    },
    {
      "sequence": 3,
      "kind": "tool",
      "name": "pnpm-check",
      "purpose": "Run typecheck, build, complete tests, capsule validation, policy verification, and deterministic evaluations.",
      "outcome": "succeeded",
      "duration_ms": null,
      "evidence": ["ev-full-gate"]
    },
    {
      "sequence": 4,
      "kind": "tool",
      "name": "issue-payload-digest",
      "purpose": "Bind the exact local issue payload and required external-transfer approval scope without publishing it.",
      "outcome": "succeeded",
      "duration_ms": null,
      "evidence": ["ev-issue-request"]
    }
  ],
  "failures_and_inefficiencies": [
    {
      "id": "fi-dsh-producer-gap",
      "category": "harness",
      "summary": "Current DSH lacks the authoritative producer and awaited final teardown seam required for end-to-end attestation availability.",
      "impact": "high",
      "recoverable": true,
      "suggested_action": "Implement and validate the launcher/Loader producer and awaited teardown contract described by the prepared tracking issue.",
      "evidence": ["ev-contract", "ev-issue-request"]
    },
    {
      "id": "fi-publication-approval",
      "category": "coordination",
      "summary": "A sensitive external publication cannot proceed without an exact current human decision.",
      "impact": "medium",
      "recoverable": true,
      "suggested_action": "Provide a schema-valid approval decision matching the prepared scope, then verify it immediately before publication.",
      "evidence": ["ev-approval-blocker", "ev-issue-request"]
    }
  ],
  "evidence": [
    {
      "id": "ev-focused-tests",
      "kind": "test",
      "uri": "command://vitest-runtime-generation-focused",
      "summary": "The focused suite passed 27 tests; five opt-in integration tests were skipped.",
      "sha256": null,
      "observed_at": "2026-09-02T23:23:34.000Z"
    },
    {
      "id": "ev-full-gate",
      "kind": "test",
      "uri": "command://pnpm-run-check-runtime-generation",
      "summary": "The full gate passed typecheck, build, 206 tests with six opt-in skips, capsule validation, policy checking, and both deterministic evaluations.",
      "sha256": null,
      "observed_at": "2026-09-02T23:23:34.000Z"
    },
    {
      "id": "ev-review",
      "kind": "human_note",
      "uri": "repo://docs/requirement-evidence.md",
      "summary": "The final automated audit found no remaining production-code defect; unsupported no-follow platforms and DSH disposal availability are fail-closed or explicitly bounded.",
      "sha256": null,
      "observed_at": "2026-09-02T23:23:34.000Z"
    },
    {
      "id": "ev-contract",
      "kind": "file",
      "uri": "repo://docs/runtime-generation-attestation.md",
      "summary": "The focused contract records the implemented boundary, compatibility rule, safety checks, and pinned upstream limitations.",
      "sha256": "5b3f9137ba109c49c2eb6c163ae01aa8959dae82df717e93f2a46295127ea196",
      "observed_at": "2026-09-02T23:23:34.000Z"
    },
    {
      "id": "ev-issue-request",
      "kind": "file",
      "uri": "repo://.dal/outbox/issue-runtime-generation-upstream-20260902.request.json",
      "summary": "The local request binds the unchanged public issue payload to its destination, purpose, and required approval scope.",
      "sha256": null,
      "observed_at": "2026-09-02T23:23:34.000Z"
    },
    {
      "id": "ev-approval-blocker",
      "kind": "human_note",
      "uri": "repo://docs/governance.md",
      "summary": "Governance requires exact send_data_externally approval before publishing the prepared issue, and no matching decision is available.",
      "sha256": null,
      "observed_at": "2026-09-02T23:23:34.000Z"
    }
  ],
  "uncertainty": [],
  "human_review": {
    "status": "pending",
    "reviewer": null,
    "reviewed_at": null,
    "notes": [
      "Implementation review is not sensitive-action approval.",
      "External issue publication remains pending a separate exact decision."
    ],
    "approval_refs": []
  },
  "privacy": {
    "classification": "internal",
    "retention": "local-only",
    "tags": ["no-secrets", "runtime-generation", "approval-pending"],
    "contains_personal_data": false,
    "redactions": []
  }
}
